venue_id,name,brand,description,color,is_available
1,Choker,Banger,"Молочный шоколад с мятой, сладкий десерт с лёгкой прохладой",#4E342E,FALSE
1,Holostyak,Banger,Тропический фруктовый напиток с женственной нотой розовых лепестков,#FFC107,FALSE
1,Iron Bru,Banger,Тот самый оранжевый лимонад Irn-Bru: сладкий цитрус с фирменной кислинкой,#FFE066,FALSE
1,Moscow Never Sleeps,Banger,Ягодное шампанское: фруктово-ягодный букет с игристой кислинкой,#C2185B,FALSE
1,Orange Biscuit,Banger,Апельсиновое печенье: сладкая цитрусовая выпечка к чаю,#FFA500,FALSE
1,Papa Ya,Banger,Папайя: сладкий экзотический фрукт с цветочными и чуть шоколадно-кофейными нюансами,#FFB74D,FALSE
1,Passion Citrus,Banger,Цитрус-маракуйя: яркий цитрусовый сок с тропической маракуйей,#FF9800,FALSE
1,Peach Maracuja,Banger,Персик и маракуйя: сладкий персик на фоне кисло-пряной маракуйи,#FFCC80,FALSE
1,PineLychee,Banger,Ананас с личи: сочный кисло-сладкий тропический микс,#FFD54F,FALSE
1,Sexy,Banger,"Грейпфрут, клубника и малина: ягодно-цитрусовый микс с лёгкой кислинкой",#FF6F61,FALSE
1,Summer Juicy,Banger,"Мультифруктовый сок: абрикос, персик, апельсин в формате густого сока",#FFB300,FALSE
1,Surf,Banger,"Голубая питахайя (драконий фрукт): мягко-сладкий, чуть травянистый тропический вкус",#FFC107,FALSE
1,Sweet Dreams,Banger,"Сладкий цитрус с ягодами: апельсин, малина и клубника в одном миксе",#C2185B,FALSE
1,Umbrella,Banger,Тропическая амбарелла: сладкий экзотический фрукт с необычной кислинкой,#FFC107,FALSE
1,Watermelon or melon,Banger,Арбуз с дыней: классический сладкий летний микс из двух бахчевых,#66BB6A,FALSE
1,Wilberry crush,Banger,Ягодный пунш/газировка: прохладный сладко-кислый ягодный лимонад,#C2185B,FALSE
1,Yummy Gum,Banger,"Жвачка арбуз-клубника, яркий конфетно-жвачечный вкус «как в детстве»",#66BB6A,FALSE
1,Blackberry Juice,Banger,Свежевыжатый ежевичный сок: сладкая спелая ежевика с лёгкой кислинкой,#4A235A,FALSE
1,Grape Lemonade,Banger,Виноградный лимонад: сладкий охлаждающий напиток из красного винограда,#7E57C2,FALSE
1,Mango Rice,Banger,Тайский десерт Mango Sticky Rice: кокосовая сладкая рисовая каша с ломтиками манго,#FFC107,FALSE
1,Cracker,Banger,"Хрустящий крекер-печенье с шоколадом и ароматной ванилью, сладкий десертный вкус",#D7B899,FALSE
1,Lemongrass,Tangiers,"Цитрусовая трава с зелёными, травянистыми оттенками",#FFD166,FALSE
1,Yellow Apple,Tangiers,Жёлтое сладкое яблоко без аниса и лакрицы,#8BC34A,FALSE
1,Strawberry,Tangiers,"Натуральная клубника, умеренно сладкая, без конфетной химозы",#FF4F79,FALSE
1,Blitzsturm,Tangiers,"Лаванда с ментолом: цветочно-мятный, прохладный профиль",#9575CD,FALSE
1,Mixed Fruit,Tangiers,"Микс манго, ананаса и грейпфрута, сладко-кислый",#FFC107,FALSE
1,Lemon Blossom,Tangiers,"Лимон с мягкой цветочной нотой, напоминание лимонного цвета/сиропа",#FFE066,FALSE
1,Pineapple,Tangiers,"Очень сочный, сладкий ананасовый сок, долгоиграющий вкус",#FFD54F,FALSE
1,Mango,Tangiers,"Спелый натуральный манго, без жвачечной химозы",#FFC107,FALSE
1,Coconut,Tangiers,"Мягкий кокос: стружка и кокосовое молоко, сладко-сливочный",#6A1B9A,FALSE
1,Melon Blend,Tangiers,"Микс дыни, арбуза и канталупы, очень сладкий",#DCE775,FALSE
1,Orange Soda,Tangiers,"Апельсиновая газировка без «пузырьков», сладкий лимонад",#FFA500,FALSE
1,Kashmir Cherry,Tangiers,"Кашмирские специи + яркая вишня, пряно-ягодный микс",#8B1E3F,FALSE
1,Blue Flower,Tangiers,Сладкий цветочный вкус с лёгкой лавандовой ноткой,#9575CD,FALSE
1,White Grape,Tangiers,"Белый виноград, сочный, сладкий, с винной ноткой",#7E57C2,FALSE
1,Wintergreen,Tangiers,"Мятная жвачка wintergreen, мощный холодок",#4DD0E1,FALSE
1,Green Apple Stuff,Tangiers,"Зелёная яблочная карамель/леденец, сладко-кислый",#C68E17,FALSE
1,Pink Grapefruit,Tangiers,Розовый грейпфрут с выраженной кислой и горькой цедрой,#FF6F61,FALSE
1,Raspberry Iced Tea,Tangiers,"Чай с малиной: сначала малина, затем чайная база",#8D6E63,FALSE
1,Regal Flower,Tangiers,Плотная роза/цветочный букет «Tangiers Rose»,#8BC34A,FALSE
1,Watermelon,Tangiers,"Полунатуральный арбуз, менее сладкий, чем",#66BB6A,FALSE
1,Juicy Peach,Tangiers,"Сладкий сочный персик, понятный соло-фрукт",#FFCC80,FALSE
1,Blueberry,Tangiers,"Полусладкая черника, ягодный миксерный вкус",#3F51B5,FALSE
1,Summer Resort,Tangiers,"Огурец с фруктами, освежающий летний микс",#8BC34A,FALSE
1,Kashmir Apple,Tangiers,Кашмирские специи + яблоко без аниса,#8BC34A,FALSE
1,2005 Blueberry,Tangiers,Классическая черника с лёгкой кремовостью,#3F51B5,FALSE
1,Liquorice,Tangiers,Лакрица/солодка с характерной сладкой пряностью,#8BC34A,FALSE
1,Double Orange,Tangiers,Двойной апельсин с неожиданной цветочной нотой,#FFA500,FALSE
1,Cocoa,Tangiers,"Какао-порошок как из шоколадного напитка, мягко сладкий",#5D4037,FALSE
1,Cool Strawberry,Tangiers,Более сладкая клубника с холодком на выдохе,#FF4F79,FALSE
1,Prince Of Gray,Tangiers,"Чёрный чай Earl Grey: бергамот, цитрус и чайная терпкость",#8D6E63,FALSE
1,Blackthorn,Tangiers,Кислая тёрн-слива с комплексными ароматическими нотами,#6A1B9A,FALSE
1,Sour Watermelon,Tangiers,"Кислый арбуз, «твист» на классический арбузный вкус",#66BB6A,FALSE
1,Sour Grape,Tangiers,"Сильно кислый виноград, ближе к зелёному/кислому соку",#7E57C2,FALSE
1,Opuntia Pear,Tangiers,Сладкая сочная опунция/кактусовая груша,#8BC34A,FALSE
1,Cactus Fruit,Tangiers,Микс арбуза и киви в стиле кактусового напитка,#66BB6A,FALSE
1,It's Like That One Breakfast Cereal,Tangiers,Сладкие фруктовые хлопья «про тукана» из детства,#8BC34A,FALSE
1,Green Tea,Tangiers,"Нежный зелёный чай, травянистый, не сладкий",#8D6E63,FALSE
1,Grape,Tangiers,"Классический виноградный вкус, между соком и конфетой",#7E57C2,FALSE
1,Absinthe,Tangiers,Анис/абсент с лёгкой мятной прохладой,#4DD0E1,FALSE
1,Kashmir Peach,Tangiers,Сладкий персик на фоне кашмирских специй и цветов,#FFCC80,FALSE
1,Lime,Tangiers,"Натуральный лайм, яркий кислый цитрус",#C7F000,FALSE
1,Kashmir Blue,Tangiers,"Кашмир + Blue Flower, очень насыщенный цветочно-пряный микс",#8BC34A,FALSE
1,Cinnamon,Tangiers,"Чистая корица, тёплая пряность без выпечки",#8D6E63,FALSE
1,Guanabana,Tangiers,Сауурсоп: кремовый тропический фрукт с лёгкой кислинкой,#FFC107,FALSE
1,Jackfruit,Tangiers,"Джекфрут, напоминает чуть солодовый ананас",#FFD54F,FALSE
1,Marigold,Tangiers,"Яркий цветочный вкус, календула/смесь жёлтых цветов",#8BC34A,FALSE
1,Yunnan Shaddok,Tangiers,Помело + апельсиново-цитрусовые ноты,#FFE082,FALSE
1,Lemon Tea,Tangiers,"Чай с лимоном, как тёплый напиток с дольками",#8D6E63,FALSE
1,Pear Watermelon,Tangiers,Микс грушевого сока и,#C9E265,FALSE
1,Tropical Punch,Tangiers,"Классический красный тропический пунш, сладко-кислый",#FFC107,FALSE
1,Mixed Fruit #6,Tangiers,Тропические фрукты с «секретной» нижней нотой,#FFC107,FALSE
1,Vanilla,Tangiers,"Классическая сливочная ваниль, мягкая и сладкая",#6A1B9A,FALSE
1,Cucumber Lavender,Tangiers,"Огурец с лавандой, свежий травяно-цветочный микс",#9575CD,FALSE
1,Pear,Tangiers,"Пряная сладкая груша, немного специй",#C9E265,FALSE
1,Peach Cobbler,Tangiers,Персиковый пирог: запечённый персик и тёплая выпечка,#FFCC80,FALSE
1,Raspberry,Tangiers,Мягкая малина без сильной кислоты,#E53935,FALSE
1,Green Apple Tea,Tangiers,"Зелёное яблоко на чайной базе, не приторно",#8BC34A,FALSE
1,Mime,Tangiers,"Лайм + мята в балансе, цитрусово-мятный микс",#C7F000,FALSE
1,Apricot,Tangiers,"Спелый абрикос, фруктовый, без специй",#FFB300,FALSE
1,Tasty Peach,Tangiers,"Сбалансированный персик, смесь сладкого и полусладкого",#FFCC80,FALSE
1,Sevilla Orange,Tangiers,Сильный апельсин с лёгкой цветочной нотой,#FFA500,FALSE
1,Welsh Cream,Tangiers,"Сливочный ликёр: сливки, ваниль и карамель",#6A1B9A,FALSE
1,Blackberry,Tangiers,"Кисло-сладкая ежевика, чуть терпкая",#4A235A,FALSE
1,Steve's Mix,Tangiers,"Лаванда, ваниль и немного лайма; мягкий цветочно-десертный микс",#9575CD,FALSE
1,Indian Summer,Tangiers,Сложный коктейль из цветочных и сладких фруктовых нот,#8BC34A,FALSE
1,Strawberry-Kiwi,Tangiers,"Клубника и киви, сладко-кислый зелёно-ягодный микс",#FF4F79,FALSE
1,Pumpkin,Tangiers,Осенний тыквенный десерт с тёплыми специями,#8BC34A,FALSE
1,Jamaica,Tangiers,"Гибискусный напиток, травяно-ягодный профиль",#C2185B,FALSE
1,Blue Gumball 2.0,Tangiers,Синяя фруктовая жвачка как из автоматов детства,#8BC34A,FALSE
1,Guajava Kiss,Tangiers,Сладкая гуава с цитрусом и специями,#43A047,FALSE
1,Mexican Mocha,Tangiers,"Кофе с корицей, шоколадом и лёгким перцем",#5D4037,FALSE
1,Guajava,Tangiers,"Чистая сладкая гуава, густой тропический вкус",#43A047,FALSE
1,Passionfruit,Tangiers,"Маракуйя: полусладкий, очень ароматный тропический фрукт",#FF9800,FALSE
1,Kashmir Guajava,Tangiers,"Гуава с кашмирскими специями, пряно-тропический вкус",#43A047,FALSE
1,Red Tea,Tangiers,"Неподслащённый красный чай, мягкая терпкость",#8D6E63,FALSE
1,Kashmir,Tangiers,"Микс специй и мощных цветочных нот, фирменный «кашир»",#8BC34A,FALSE
1,Old School Watermelon,Tangiers,"Арбузная конфета, очень сладкий «олдскульный» арбуз",#66BB6A,FALSE
1,Lemon-Lime,Tangiers,"Лимон и лайм, классический цитрусовый спрайтовый микс",#FFE066,FALSE
1,Kashmir Black,Tangiers,"Кашмир + тёмная ежевика, пряно-ягодный профиль",#4A235A,FALSE
1,Apricot Spring Blend,Tangiers,"Освежающий абрикосовый бленд, лёгкий весенний фрукт",#FFB300,FALSE
1,Tropical Revenge!,Tangiers,Тропический пунш с добавлением грейпфрута,#FF6F61,FALSE
1,Hotchata,Tangiers,"Хорчата: корица, сливки и молочный десертный профиль",#8D6E63,FALSE
1,Clove,Tangiers,"Чистая гвоздика, насыщенный пряный вкус",#6D4C41,FALSE
1,Summer Solstice Celebration,Tangiers,"Гуава, арбуз и микс фруктов, летний фруктовый салат",#43A047,FALSE
1,Sour,Tangiers,Универсальный кислый бустер с тёмным табачным оттенком,#8BC34A,FALSE
1,Brambleberry,Tangiers,"Красные ягоды и ежевика, слегка кисловатый микс",#C2185B,FALSE
1,Boysenberry,Tangiers,"Бойзенова ягода: что-то между малиной, ежевикой и ежемалиной",#C2185B,FALSE
1,Spearmint,Tangiers,"Сладкая мята-spearmint, как свежая жвачка",#4DD0E1,FALSE
1,Tuscan Cantaloupe,Tangiers,"Сладкая канталупа, мягкая дыня без травки",#DCE775,FALSE
1,Kiwi,Tangiers,"Натуральное киви, сладость с небольшой цитрусовой кислинкой",#66BB6A,FALSE
1,Cherry Limeade,Tangiers,Сладкая вишня + лаймовый лимонад,#8B1E3F,FALSE
1,Chocolate Iced Cream,Tangiers,"Шоколадное мороженое/крем, десертный шоколад",#4E342E,FALSE
1,Nectarine,Tangiers,Нектарин: сладкий фрукт с лёгкой цветочной кислинкой,#8BC34A,FALSE
1,Peach Iced Tea,Tangiers,Несладкий белый персик с чайной нотой,#FFCC80,FALSE
1,Lemon,Tangiers,"Натуральный лимон, скорее тёмный/натуральный, чем конфетный",#FFE066,FALSE
1,Mimon,Tangiers,"Лимон с мятой, что-то вроде лимонного мохито",#FFE066,FALSE
1,Maraschino Cherry,Tangiers,Очень сладкая марципановая коктейльная вишня,#8B1E3F,FALSE
1,Grapefruit,Tangiers,Грейпфрут средней кислоты с лёгкой горечью,#FF6F61,FALSE
1,Cane Mint,Tangiers,Легендарная мята: мощный пеперминт с сильным холодком,#4DD0E1,FALSE
1,Chocolate Mint,Tangiers,"Классика шоколад + мята, как десерт/морожёное",#4E342E,FALSE
1,Static Starlight,Tangiers,Тёмный виноград с мягкой цветочной сладостью,#7E57C2,FALSE
1,It's Like That Other Breakfast Cereal,Tangiers,"Другие сладкие хлопья «про кролика», фруктово-сахарные",#8BC34A,FALSE
1,Panic Punch,Tangiers,"Микс арбуза и лайма, тропический «пунш»",#66BB6A,FALSE
1,Little Purple Stuff,Tangiers,Сладкая конфетная чёрная виноградная «леденцовая» смесь,#7E57C2,FALSE
1,Foreplay On The Peach,Tangiers,"Очень сладкий сочный персик, без специй",#FFCC80,FALSE
1,Pinepas,Tangiers,"Ананас + маракуйя, яркий тропический дуэт",#FFD54F,FALSE
1,"""Now With Melon""",Tangiers,"Популярный микс дынь/арбузов, мягкий сладкий мелон",#DCE775,FALSE
1,Hacitragus,Tangiers,"Кислый цитрусовый микс, яркий и терпкий",#FFD166,FALSE
1,Rangoon Sunrise,Tangiers,"Кисло-сладкий цитрусово-ягодный микс: клюква, малина, лайм",#C2185B,FALSE
1,French Jelly,Tangiers,"Экзотический микс «желейных» фруктов, мягко сладкий",#FFC107,FALSE
1,Ololiuqui,Tangiers,"Рутбир / корневое пиво, как бочковые конфеты",#8BC34A,FALSE
1,Aussie Juice,Tangiers,"Клубника и киви, сладко-кислый «австралийский сок» с лёгкой ванилью",#FF4F79,FALSE
1,Experimint,Tangiers,"Очень сильный spear­mint-холодок, экстремальная мятка для миксов",#4DD0E1,FALSE
1,Mandarin Orange,Tangiers,"Мандариновый апельсин, альтернатива Orange Soda без газировки",#FFA726,FALSE
1,Forbidden Fruit,Tangiers,"Необычный фруктовый микс, напоминает сладкую сочную мякоть яблока",#8BC34A,FALSE
1,Pikina Sun,Tangiers,"Тропик: ананас + киви (иногда с кокосом/арбузом), яркий сладко-кислый микс",#FFD54F,FALSE
1,Dark Cherry,Tangiers,"Тёмная вишня, ассоциация с вишнёвой «доктор-колой»",#8B1E3F,FALSE
1,Papaya Sorbet,Tangiers,Сладкий десерт-сорбет из папайи,#FFB74D,FALSE
1,Kosmik,Tangiers,"Кремовый микс аниса/лакрицы и яблока, что-то вроде дабл-эпл",#8BC34A,FALSE
1,Refreshing Melon Berry,Tangiers,"Сочный микс сладкой дыни и ягод, очень освежающий",#DCE775,FALSE
1,Chocolate Cherry,Tangiers,Десерт шоколад + вишня: тёмный шоколад и сладкая ягода,#4E342E,FALSE
1,1888 Rom Brugal,Satyr,"Ром «Brugal 1888» – тёмный алкогольный табачный профиль с нотами дуба, ванили и карамели",#F5E6CC,FALSE
1,1915,Satyr,"Цветы франжипани со специями, мягкий цветочный вкус с тёплой пряностью",#8BC34A,FALSE
1,Acai,Satyr,Ягоды асаи – сладко-кислый лесной микс с лёгкой терпкостью,#C2185B,FALSE
1,Aladdin,Satyr,"Восточные сладости: цветочно-шоколадный десерт, густой и сладкий",#4E342E,FALSE
1,Ana-nas,Satyr,Натуральный ананасовый сок без конфетной химозы,#FFD54F,FALSE
1,Angel Tits,Satyr,Десертная вишня – сладкая вишня в сиропе с лёгкой кислинкой,#8B1E3F,FALSE
1,Anton-ovka,Satyr,Классическое двойное яблоко с лёгким алкогольным оттенком самбуки,#8BC34A,FALSE
1,Apelmizo,Satyr,"Сочный апельсин, яркий цитрусовый фреш",#FFA500,FALSE
1,Apple Paradise (Райское яблоко),Satyr,Сладкое красное яблоко с лёгкой пряностью,#8BC34A,FALSE
1,Atacama,Satyr,"Кактус: травянистый, чуть сладко-кислый экзотический вкус",#8BC34A,FALSE
1,Atomic Juice,Satyr,Фейхоа – яркий мармеладный фейхоа с терпкой кислинкой и тропическими нотами,#4CAF50,FALSE
1,Babushka,Satyr,"Цитрусовые леденцы с личи – апельсин, лимон, личи и карамель",#F8BBD0,FALSE
1,Bacon,Satyr,Жареный бекон: жирный копчёный мясной вкус,#8BC34A,FALSE
1,Bahia Brazil,Satyr,"Сигарный табак из провинции Байя: торфяной, мёд, кисловатые цитрусы, плотная дымность",#6B4F2A,FALSE
1,Balalaika (Балалайка),Satyr,"Итальянский табачный безароматический бленд: летний луг, медовые травы",#8BC34A,FALSE
1,Banana,Satyr,"Спелый банан, густой сливочно-фруктовый профиль",#FFE082,FALSE
1,Barberry,Satyr,Яркий барбарис – кисло-сладкая карамель,#C62828,FALSE
1,Barberry Dokha,Satyr,Табачный бленд с докхой и барбарисом: сухой табак и кислая ягода,#C62828,FALSE
1,Basis Moscow,Satyr,"Бленд никарагуанских табаков: тёплая хлебная корка, сухие травы, мягкая табачность",#6B4F2A,FALSE
1,Blackberry,Satyr,Ежевика: сладкая ягода с мускусно-травяным фоном и лёгкой кислинкой,#4A235A,FALSE
1,Black Currant,Satyr,"Классическая насыщенная чёрная смородина, сладко-кислая",#2E1A47,FALSE
1,Black Dokha,Satyr,"Очень крепкий табачный бленд с докхой: сухой, пряно-травянистый",#8BC34A,FALSE
1,Black Ice,Satyr,"Яркий эвкалиптовый ментол, мощный холод без фруктовой базы",#26A69A,FALSE
1,Black Jack,Satyr,"Вирджиния + Burley, ферментированные в бурбоне: черешня, мелисса, лёгкий огурец",#8BC34A,FALSE
1,Black Special,Satyr,"Вымоченная в спирте вирджиния: от сухофруктов к орехам и цветам, мягкий табачный лист",#8BC34A,FALSE
1,Black Virginia Gold,Satyr,"Плотный тёмный табак Virginia Gold: сладко-табачный, слегка древесный",#6B4F2A,FALSE
1,Blood,Satyr,Гранат – сочная сладко-кислая сердцевина и вяжущая кожура,#C62828,FALSE
1,Blue Cheese,Satyr,"Сырный соус «блю чиз»: сливочный сыр, лёгкая молочная сладость и пикантность",#6A1B9A,FALSE
1,Blueberry Nights,Satyr,"Черничный йогурт: черника, сливки и творожная нотка",#FFF3E0,FALSE
1,Blue Sirius,Satyr,Освежающая черника с лёгким холодком,#3F51B5,FALSE
1,Bom-Byao,Satyr,"Виноградная газировка по-корейски, сладкий газированный чёрный виноград",#7E57C2,FALSE
1,Brownie,Satyr,Шоколадный брауни: густой какао-десерт с нотками выпечки и карамели,#4E342E,FALSE
1,Burley Cointreau,Satyr,"Burley, вымоченный в апельсиновом ликёре Cointreau: табак + цитрусовый ликёр",#FFA500,FALSE
1,Burley Cognac,Satyr,Чистый Burley с коньяком: тёплые дубовые и алкогольные оттенки,#8BC34A,FALSE
1,California Cola,Satyr,Сладкая кола с карамелью и лёгкой лимонной кислинкой,#3E2723,FALSE
1,Charmer,Satyr,Лаванда с черникой – цветочно-ягодный мягкий микс,#9575CD,FALSE
1,Cherry,Satyr,"Сочная вишня, баланс сладости и кислоты",#8B1E3F,FALSE
1,Cherry Coca,Satyr,"Вишнёвая кола, газированная вишня с карамельной колой",#8B1E3F,FALSE
1,Chika,Satyr,"Спелая гуава, сладкий тропический сок",#43A047,FALSE
1,Clockwork Orange,Satyr,Заводной апельсин – яркий апельсиновый фреш с горчинкой цедры,#FFA500,FALSE
1,Cornhoolio,Satyr,Сладкая сливочная кукуруза,#6A1B9A,FALSE
1,Cranberry / North Berry,Satyr,"Северная клюква: яркая кисло-сладкая, как морс",#B71C1C,FALSE
1,Cubita Colombia (№2),Satyr,"Копчёный, пряный, слегка кисловатый табачный вкус с кофейными нотами",#5D4037,FALSE
1,Cubano Ligero Viso (№3),Satyr,Сладкий алкогольный табачный вкус в кубинском стиле,#8BC34A,FALSE
1,Cubus Rubus,Satyr,Лесная малина – яркая сладко-кислая ягода,#E53935,FALSE
1,Dedushka,Satyr,"Лесная земляника, сочная и сладкая",#8BC34A,FALSE
1,Dubek Jagermeister,Satyr,Вкус Jägermeister – травяной ликёр на табачной базе,#8BC34A,FALSE
