venue_id,name,brand,description,color,is_available
1,ADMIRAL ACBAR CEREAL,DarkSide,Сливочная сладкая овсяная каша с ягодами,#6A1B9A,FALSE
1,APPLECOT,DarkSide,Сочное кислое зелёное яблоко,#8BC34A,FALSE
1,ASTRO TEA,DarkSide,"Чай с лимоном, мягкий цитрусовый чайный вкус",#8D6E63,FALSE
1,BANANAPAPA,DarkSide,Натуральный сладкий спелый банан,#FFE082,FALSE
1,BARBERRY GUM,DarkSide,"Барбарисовая жвачка, сладко-кислые конфетки барбарис",#C62828,FALSE
1,BARVY CITRUS,DarkSide,"Яркий цитрусовый микс (лимон, апельсин, грейпфрут)",#FFE066,FALSE
1,BARVY ORANGE,DarkSide,Сладкий сочный апельсин,#FFA500,FALSE
1,BASIL BLAST,DarkSide,Свежий зелёный базилик с лёгкой сладостью,#2E7D32,FALSE
1,BASSBERRY,DarkSide,Ягоды бузины: сладко-кислый ягодный вкус с цветочными нотками,#C2185B,FALSE
1,BERGAMONSTR,DarkSide,"Насыщенный бергамот, чайный цитрусовый аромат",#8D6E63,FALSE
1,BLACKBERRY,DarkSide,Спелая сладкая ежевика,#4A235A,FALSE
1,BLACKCURRANT,DarkSide,"Чёрная смородина, насыщенный ягодный вкус",#2E1A47,FALSE
1,BLUEBERRY BLAST,DarkSide,Яркая сладкая черника,#3F51B5,FALSE
1,BOUNTY HUNTER,DarkSide,Холодный кокос в стиле батончика «Баунти» (кокос + сливочность + лёгкий холодок),#6A1B9A,FALSE
1,BREAKING RED,DarkSide,Сладко-кислый спелый гранат с лёгкой терпкостью,#C62828,FALSE
1,C.R.E.A.M. S.O.D.A.,DarkSide,"Крем-сода: сладкая ванильная сливочная газировка, лёгкий освежающий лимонадный оттенок",#F5E6CC,FALSE
1,CHERRY ROCKS,DarkSide,"Яркие вишнёвые леденцы, насыщенная кисло-сладкая вишня",#8B1E3F,FALSE
1,CINNAMOON,DarkSide,"Тёплая булочка с корицей, мягкая сладкая корица без «ядерности»",#E0B589,FALSE
1,CODE CHERRY,DarkSide,"Сочный вишнёвый сок / вишнёвый компот, «чистая» вишня",#8B1E3F,FALSE
1,COSMO FLOWER,DarkSide,Цветочный аромат с ягодными нотами (цветы + лёгкая черника),#C2185B,FALSE
1,COSMOS,DarkSide,"Коктейль «Космополитен»: клюква, цитрус, лёгкая сладость алкогольного коктейля",#B71C1C,FALSE
1,CRYSTAL GRAPE,DarkSide,Сладкий слегка освежающий белый виноград,#7E57C2,FALSE
1,CUCUMSTAR,DarkSide,"Огурец / огуречный лимонад, свежий огуречный вкус",#FFE066,FALSE
1,CYBER KIWI,DarkSide,"Кисло-сладкое спелое киви, сочный фруктовый вкус",#66BB6A,FALSE
1,DARK ICECREAM,DarkSide,"Шоколадное мороженое, сливочный десерт с какао",#4E342E,FALSE
1,DARK MINT,DarkSide,Плотная тростниковая мята: мощный мятный/ментоловый холод,#4DD0E1,FALSE
1,DARK PASSION,DarkSide,Кисло-сладкая маракуйя с лёгкой терпкостью,#FF9800,FALSE
1,DARK SPIRIT,DarkSide,"Коктейль «Маргарита»: цитрус, лайм, лёгкая алкогольная нота",#C7F000,FALSE
1,DARKSIDE COLA,DarkSide,"Кола, газированный коловый напиток с карамелью и цитрусом",#3E2723,FALSE
1,DARKSIDE COOKIE,DarkSide,"Шоколадное печенье с бананом, сладкий десертный вкус",#4E342E,FALSE
1,DARKSUPRA,DarkSide,Жасминовый чай: цветочный зелёный чай с жасмином,#8D6E63,FALSE
1,DEEP BLUE SEA,DarkSide,"Лимонад «Байкал» с десертно-кокосовыми нотами, напоминает кокосовое печенье с травянистостью",#FFE066,FALSE
1,DESERT EAGLE,DarkSide,Сладкий кактус: сочная мякоть опунции с лёгким терпким послевкусием,#8BC34A,FALSE
1,ECLIPSE,DarkSide,"Цитрусовые леденцы с мёдом, медово-цитрусовый конфетный вкус",#FFCA28,FALSE
1,EXTRAGON,DarkSide,Тархун: сладкая эстрагоновая газировка,#66BB6A,FALSE
1,FALLING STAR,DarkSide,"Манго + маракуйя, яркий тропический дуэт",#FFC107,FALSE
1,FRUITTALLITY,DarkSide,Сладкие жевательные конфеты с соком лесных ягод,#C2185B,FALSE
1,FRUITY DUST,DarkSide,"Экзотический фруктовый микс, тропические фрукты",#FFC107,FALSE
1,GENERIS RASPBERRY,DarkSide,"Сочная малина, натуральный малиновый вкус",#E53935,FALSE
1,GLITCH ICE TEA,DarkSide,Холодный персиковый чай (ледяной чай с персиком),#FFCC80,FALSE
1,GOAL,DarkSide,Черничный энергетик: сладкая черника в энергетическом напитке с лёгкой свежестью,#3F51B5,FALSE
1,GONZO CAKE,DarkSide,"Чизкейк: сливочный сыр, ванильный десерт с бисквитной основой",#6A1B9A,FALSE
1,GRAPE CORE,DarkSide,Классический виноградный вкус (тёмный виноград),#7E57C2,FALSE
1,GREEN BEAM,DarkSide,Фейхоа: сладко-кислый фейхоа с травянистым оттенком,#4CAF50,FALSE
1,GREEN MIST,DarkSide,"Цитрусовый алкогольный коктейль в стиле кайпириньи: лайм, кашаса, лёгкий лёд",#C7F000,FALSE
1,GUAVA REBEL,DarkSide,Сочная мякоть гуавы с лёгкой травянистостью и терпкостью,#43A047,FALSE
1,HONEY DUST,DarkSide,"Натуральный цветочный мёд, сладкий мёд с лёгкой терпкой нотой",#FFCA28,FALSE
1,ICE GRANNY,DarkSide,Ледяное зелёное яблоко: кислое яблоко с холодком,#8BC34A,FALSE
1,KALEE GRAPEFRUIT 2.0,DarkSide,Яркий сочный грейпфрут с лёгкой горечью цедры,#FF6F61,FALSE
1,KASHMIR GOA JAVA,DarkSide,Кисло-сладкая гуаява с выраженными индийскими специями и лёгким алкогольным оттенком коктейля,#8BC34A,FALSE
1,KILLER MILK,DarkSide,"Насыщенная сладкая сгущёнка, сливочно-карамельное сгущённое молоко",#6A1B9A,FALSE
1,LEMONBLAST,DarkSide,"Сочный кисло-сладкий лимон, лимонадный цитрус",#FFE066,FALSE
1,MANGO LASSI,DarkSide,Спелый манго в сливочном йогуртовом коктейле (манго-ласси),#FFC107,FALSE
1,MANGO LASSI 2.0,DarkSide,Обновлённый манго-ласси: более яркий манго с мягкой сливочностью,#FFC107,FALSE
1,NEEDLS,DarkSide,Сосновые иголки / еловый лес: смолистый хвойный вкус,#8BC34A,FALSE
1,NØRDBERRY,DarkSide,"Охлаждённый кисло-сладкий клюквенный морс, клюква с лёгким льдом",#B71C1C,FALSE
1,NUTZ,DarkSide,"Ореховый десерт, сладкий орех (арахис/фундучный крем)",#8BC34A,FALSE
1,PEAR,DarkSide,Сочная сладкая груша,#C9E265,FALSE
1,PINEAPPLE PULSE,DarkSide,"Яркий натуральный ананас, сладкая мякоть ананаса с лёгкой кислинкой",#FFD54F,FALSE
1,POLAR CREAM,DarkSide,Фисташковое мороженое: сливочно-ореховый холодный десерт,#FFF8E1,FALSE
1,POMELOW,DarkSide,Сладкое помело с характерной лёгкой терпкостью,#FFE082,FALSE
1,RAF IN THE JUNGLE,DarkSide,Кофе RAF: мягкий сливочно-шоколадный кофейный раф с апельсиновой цедрой,#5D4037,FALSE
1,RED ALERT,DarkSide,Арбуз+дыня: арбузный фреш с мякотью медовой дыни в безалкогольном коктейле,#66BB6A,FALSE
1,RED RUSH,DarkSide,Барбарисовые леденцы: сладкие конфетки-барбариски с лёгкой кислинкой,#C62828,FALSE
1,RED TEA,DarkSide,"Красный чай / каркаде, терпко-кислый чайный вкус",#8D6E63,FALSE
1,RED ZEPPELIN,DarkSide,"Ягодно-фруктовый красный лимонад (красные ягоды с цитрусом), освежающий микс",#C2185B,FALSE
1,REDBERRY,DarkSide,Красная смородина: яркий кисло-сладкий смородиновый вкус,#2E1A47,FALSE
1,RIVERS OF BLOOD,DarkSide,"Коктейль «Кровавая Мэри»: томатный сок, специи, сельдерей, острый пряный томатный микс",#8BC34A,FALSE
1,SALBEI,DarkSide,Шалфей: травяной шалфейный вкус с лёгкой горчинкой,#8BC34A,FALSE
1,SAMBUKA SHOT,DarkSide,"Самбука: сладкий анисовый ликёр, анис/лакрица",#8BC34A,FALSE
1,SKYLIME,DarkSide,"Яркий лайм: свежий кисло-сладкий лайм, цитрусовый микс для освежения",#C7F000,FALSE
1,SPACE DESSERT,DarkSide,"Тирамису: кофе, маскарпоне, немного алкоголя, сливочный десерт",#5D4037,FALSE
1,SPACE JAM,DarkSide,Клубничный джем: сладкая клубника в сиропе/варенье,#FF4F79,FALSE
1,SPACE LYCHEE,DarkSide,"Нежная мякоть личи / «китайской сливы»: тропический фрукт с нотами ананаса, винограда и клубники, лёгкая пряность",#F8BBD0,FALSE
1,SPICY PEAR,DarkSide,Груша со специями: сладкая груша с тёплой пряной ноткой,#C9E265,FALSE
1,STARLIME,DarkSide,"Лаймовый цитрусовый микс: яркий лайм с лёгкой сладостью, освежающий вкус",#C7F000,FALSE
1,STRAWBERRY LIGHT,DarkSide,"Сладкая клубника, классический ягодный вкус без тяжёлой десертности",#FF4F79,FALSE
1,SUPERMINT,DarkSide,"Очень мощный ментоловый холод, смесь мяты/ментола с максимальной свежестью",#81D4FA,FALSE
1,SUPERNOVA,DarkSide,Экстремальный холодок: чистый сильный ледяной аромат без яркого вкуса,#8BC34A,FALSE
1,SWEET COMET,DarkSide,Клюква и банан: сладко-кислый клюквенный банановый десерт,#B71C1C,FALSE
1,TOP GUM,DarkSide,Жвачка со вкусом клубники и арбуза с лёгким послевкусием дыни,#FF4F79,FALSE
1,TORPEDO,DarkSide,"Арбуз+дыня, классический микс арбуза и дыни",#66BB6A,FALSE
1,TROPIC RAY,DarkSide,"Тропический фруктовый микс (манго, ананас, другие тропики)",#FFC107,FALSE
1,VIRGIN MELON,DarkSide,Сладкая спелая дыня,#DCE775,FALSE
1,VIRGIN PEACH,DarkSide,"Нежный сладкий персик, мягкий фруктовый вкус",#FFCC80,FALSE
1,VIRGIN PEACH 2.0,DarkSide,Обновлённый персик: более яркий и сочный вкус персика,#FFCC80,FALSE
1,WAFFLE SHUFFLE,DarkSide,Лимонные вафли: хрустящие вафли с лимоном и сливочным кремом,#FFE066,FALSE
1,WILD FOREST,DarkSide,"Лесные ягоды: черника, малина, смородина, насыщенный ягодный микс",#C2185B,FALSE
1,WILDBERRY,DarkSide,"Ягодный микс, ассорти лесных ягод",#C2185B,FALSE
1,Apple Drops,MustHave,Сладкие карамельные яблочные леденцы,#C68E17,FALSE
1,Baikal,MustHave,"Травяной напиток с хвойной нотой, напоминает байкал",#8BC34A,FALSE
1,Banana Mama,MustHave,Сладкий спелый южный банан,#FFE082,FALSE
1,Barberry Candy,MustHave,Ностальгические барбарисовые конфеты из детства,#C62828,FALSE
1,Berry Holls,MustHave,Лесные ягоды с прохладным эвкалиптовым холодком,#C2185B,FALSE
1,Black Currant,MustHave,Яркая сочная чёрная смородина с лёгкой кислинкой,#2E1A47,FALSE
1,Blackberry,MustHave,Сладкая спелая ежевика с лёгкой винной ноткой,#4A235A,FALSE
1,Blueberry,MustHave,"Черника в сливочном йогурте, мягкий ягодный десерт",#3F51B5,FALSE
1,Candy Cow,MustHave,"Сливочная карамель, напоминающая ириски",#6A1B9A,FALSE
1,Caribbean rum,MustHave,Ромовый напиток: сладкий тёмный ром с лёгкой пряностью,#8BC34A,FALSE
1,Cherry-Cola,MustHave,Колa с миксом кислой дикой и сладкой садовой вишни,#8B1E3F,FALSE
1,Choco-Mint,MustHave,Тёмный шоколад с охлаждающим мятным кремом,#4E342E,FALSE
1,Christmas Drink,MustHave,"Лёгкий игристый вкус шампанского, новогодний напиток",#8BC34A,FALSE
1,Cinnamon,MustHave,"Тёплая сладко-пряная корица, бархатистая пряность",#8D6E63,FALSE
1,Coconut Shake,MustHave,"Сладкий кокосовый шейк, сливочный тропический коктейль",#6A1B9A,FALSE
1,Cookie,MustHave,Хрустящее шоколадное песочное печенье со сливочной начинкой,#4E342E,FALSE
1,Cola,MustHave,Классический сладкий вкус газированной колы,#FFF176,FALSE
1,Cranberry,MustHave,Терпкая северная клюква с яркой кислинкой,#B71C1C,FALSE
1,Cucunade,MustHave,Огуречный лимонад с лимоном и листьями мяты,#FFE066,FALSE
1,Estragon,MustHave,Напиток «Тархун» — сладкая газировка с эстрагоном,#66BB6A,FALSE
1,Feijoa,MustHave,Терпкая спелая фейхоа с зелёной экзотической нотой,#4CAF50,FALSE
1,Fizzy Dizzy,MustHave,"Игристый напиток с барбарисом, шипучий кисло-сладкий лимонад",#C62828,FALSE
1,Forest Berries,MustHave,Бархатный микс лесных ягод с акцентом на ежевику,#C2185B,FALSE
1,Frosty,MustHave,"Сильный бодрящий ментоловый холодок, «морозный воздух»",#81D4FA,FALSE
1,Grapefruit,MustHave,Кисло-сладкий микс розового и оранжевого грейпфрута,#FF6F61,FALSE
1,Honey Holls,MustHave,"Холодок с густым сладким мёдом, медовые леденцы зимой",#FFCA28,FALSE
1,Ice cream,MustHave,Нежный сливочный пломбир с мягким молочным послевкусием,#6A1B9A,FALSE
1,Ice Mint,MustHave,Мятная жвачка с мощным охлаждающим эффектом,#4DD0E1,FALSE
1,Kiwi Smoothie,MustHave,Кисло-сладкий киви-коктейль с мятой и яблочным соком,#66BB6A,FALSE
1,Lemon Pie,MustHave,Тёплый домашний лимонный пирог с цитрусовой кислинкой,#FFE066,FALSE
1,Lemon-Lime,MustHave,Сочный цитрусовый микс лимона и лайма,#FFE066,FALSE
1,Mad Pear,MustHave,Сладкий насыщенный грушевый нектар,#C9E265,FALSE
1,Mango Sling,MustHave,Лимонад из тайского манго со специями и мятой,#FFE066,FALSE
1,Marula,MustHave,Сладкий сложный вкус африканского фрукта марула,#8BC34A,FALSE
1,Masala Tea,MustHave,Сладкий пряный индийский чай масала со специями,#8D6E63,FALSE
1,Melonade,MustHave,"Лимонад из арбузного сока, спелой дыни и барбариса",#FFE066,FALSE
1,Milky Rice,MustHave,Ностальгическая сладкая молочная рисовая каша,#8BC34A,FALSE
1,Morocco,MustHave,Тёплый марокканский цитрусовый чай со специями,#8D6E63,FALSE
1,Mulled Wine,MustHave,Глинтвейн: тёплое красное вино с пряностями и фруктами,#8BC34A,FALSE
1,Nord Star,MustHave,Кисло-сладкая сочная вишня сорта,#8B1E3F,FALSE
1,Orange Team,MustHave,Натуральный микс апельсина и мандарина,#FFA500,FALSE
1,Paradise,MustHave,"Банан в карамели с кокосовой стружкой, десертный тропик",#FFE082,FALSE
1,Peppermint,MustHave,Глубокая сладкая перечная мята с долгим ментоловым хвостом,#4DD0E1,FALSE
1,Pineapple Rings,MustHave,Сочные сладкие ананасовые колечки в собственном соке,#FFD54F,FALSE
1,Pinkman,MustHave,Розовый грейпфрут и клубника с малиновым сиропом,#FF6F61,FALSE
1,Pistachio,MustHave,"Спелая слегка обжаренная фисташка, ореховый десерт",#8BC34A,FALSE
1,Pistachio Cake,MustHave,"Фисташковый пирог с малиной, сливочно-ягодный десерт",#E0B589,FALSE
1,Quince,MustHave,Сладкая терпкая айва с лёгким анисовым оттенком,#8BC34A,FALSE
1,Raspberry,MustHave,Натуральное сладкое домашнее малиновое варенье,#E53935,FALSE
1,Red Bomb,MustHave,"Южный гранат: терпкий, сочный, с лёгкой горчинкой",#C62828,FALSE
1,Rocketman,MustHave,Клубничная содовая с дольками киви и грейпфрута,#66BB6A,FALSE
1,Ruby Grape,MustHave,Свежий коктейль с преобладанием рубинового винограда,#7E57C2,FALSE
1,Sea Buckthorn Tea,MustHave,Облепиховый чай с нотами грейпфрута и имбиря,#8D6E63,FALSE
1,Space Flavour,MustHave,"Манго, маракуйя и личи с лепестками роз и лёгким холодком",#FFC107,FALSE
1,Strawberry-Lychee,MustHave,"Спелая лесная земляника и экзотический личи, бархатный микс",#F8BBD0,FALSE
1,Sweet Melon,MustHave,Сочная мускусная спелая дыня,#DCE775,FALSE
1,Sweet Peach,MustHave,Насыщенный вкус сладкого сочного персика,#FFCC80,FALSE
1,Tropic Juice,MustHave,Насыщенный тропический сок ананаса и маракуйи,#FFD54F,FALSE
1,Vanilla cream,MustHave,"Мягкий сладкий ванильный крем, десертная база",#F5E6CC,FALSE
1,Unicorn Treats,MustHave,"Кукурузные палочки с безе и маршмеллоу, сливочный сладкий микс",#6A1B9A,FALSE
1,Watermelon,MustHave,"Бахчевой арбуз: спелый, сочный, в меру сладкий",#66BB6A,FALSE
1,Gooseberry,MustHave,Спелые ягоды крыжовника с вязкостью и яркой кислинкой,#C2185B,FALSE
1,Araram,MustHave,"Арбуз, виноград и чернослив с освежающей мятой",#66BB6A,FALSE
1,Burley Base,MustHave,Чистый табачный вкус бленда Burley без ароматизатора,#8BC34A,FALSE
1,Maple pecan,MustHave,"Тёплый десерт: слоёное тесто, кленовый сироп и орех пекан",#8BC34A,FALSE
1,Charlotte pie,MustHave,Горячий яблочный пирог-шарлотка с карамельной начинкой,#E0B589,FALSE
1,Mandarin,MustHave,"Сладкий спелый мандарин, новогодний цитрус",#FFA726,FALSE
1,Citrus Spritz,MustHave,"Лёгкий цитрусовый коктейль с содовой, искристый и освежающий",#FFD166,FALSE
1,Holland Pie,MustHave,Голландский пирог: сладкое тесто и тёплая фруктовая начинка,#E0B589,FALSE
1,Jumango,MustHave,"Манго, мёд и малина в мягком тропическом миксе",#FFC107,FALSE
1,Green Fizz,MustHave,"Кактус, киви и абсент, кислый травянистый лимонад",#8BC34A,FALSE
1,Strawberry,MustHave,"Натуральная спелая клубника, сочный ягодный вкус",#FF4F79,FALSE
1,Berry Mors,MustHave,Домашний ягодный морс из лесных и садовых ягод,#C2185B,FALSE
1,Milk Oolong,MustHave,"Сладковатый молочный улун, мягкий сливочный чай",#6A1B9A,FALSE
1,Alova,MustHave,"Гуава и алоэ, свежий тропический микс с зелёной нотой",#43A047,FALSE
1,Prosecco,MustHave,"Лёгкое игристое белое вино, свежий винный профиль",#8BC34A,FALSE
1,Lemongrass,MustHave,"Лемонграсс и лайм, цитрусово-травяной освежающий вкус",#C7F000,FALSE
1,Elderberry,MustHave,Сладкая тёмная бузина с лёгкой кислинкой,#8BC34A,FALSE
1,Musthave x Cocoloco,MustHave,"Кокосовый мильфей с ягодами, сливочный десерт",#C2185B,FALSE
1,Cacao,MustHave,Какао-напиток в стиле классического горячего шоколада,#5D4037,FALSE
1,Cinnamon roll,MustHave,Сладкая булочка-улитка с корицей и сливочной глазурью,#E0B589,FALSE
1,Cream Soda,MustHave,Сливочная газировка крем-сода с ванильной сладостью,#6A1B9A,FALSE
1,Guanapapa,MustHave,Экзотический сливочный микс гуанабаны и нежной папайи,#6A1B9A,FALSE
1,Red Tea,MustHave,"Терпкий красный фруктовый чай, напоминающий каркаде",#8D6E63,FALSE
1,Sour Citrus,MustHave,Кислый цитрусовый микс апельсина и лайма с горчинкой грейпфрута,#FFA500,FALSE
1,Sour Tropic,MustHave,Натуральный тропический коктейль с выразительной кислинкой,#FFC107,FALSE
1,Sour Berries,MustHave,Яркий микс кислых лесных ягод,#C2185B,FALSE
1,Sour Apple,MustHave,Свежие кислые зелёные яблоки с яркой кислинкой,#8BC34A,FALSE
1,Yolka,MustHave,"Чистая хвоя, аромат мокрой ели после дождя",#8BC34A,FALSE
1,Cherry Juice,MustHave,Сладкий вишнёвый сок с лёгкой терпкостью косточки,#8B1E3F,FALSE
1,Lemon Tonic,MustHave,Газированный лимонный тоник с горчинкой биттера,#FFF176,FALSE
1,Passion Plum,MustHave,Спокойный фруктовый микс маракуйи и кислой сливы,#FF9800,FALSE
1,Garnet Grape,MustHave,Кисло-сладкий южный гранат и сочный виноград,#C62828,FALSE
1,Tipsy,MustHave,"Ликёрный коктейль: сладкий ликёр, арбузный сок, сливки и ягодный топпинг",#66BB6A,FALSE
1,Violet,MustHave,"Экзотический сливочный шейк с черникой, дыней и пряностями",#6A1B9A,FALSE
1,Pearl Pool,MustHave,Нежный воздушный мусс из тропических фруктов с кисло-сладкой нотой моринги,#FFC107,FALSE
1,Cheesecake,MustHave,Песочное тесто с лёгкой ореховой нотой и бархатистой творожно-ванильной начинкой с лимонной кислинкой,#F5E6CC,FALSE
1,After 8,BlackBurn,Шоколадно-мятные конфеты в стиле After Eight: мягкий шоколад и свежая мята с длительным послевкусием,#4E342E,FALSE
1,Almond Icecream,BlackBurn,Сливочное мороженое с миндальным орехом: мягкий сливочный вкус и лёгкая ореховая горчинка,#6A1B9A,FALSE
