venue_id,name,brand,description,color,is_available
1,Гомер (Gomer),Хулиган,Виноградная газировка с алоэ,#7E57C2,FALSE
1,Скуби (Scooby),Хулиган,Цветочная малина с розовым акцентом,#E53935,FALSE
1,Флеш (Flash),Хулиган,"Медовая малина, сладкий плотный профиль",#E53935,FALSE
1,Бэтс (Bats),Хулиган,Мандариновая кола,#FFA726,FALSE
1,Логан (Logan),Хулиган,Яблочная слива с лёгкой ферментацией,#6A1B9A,FALSE
1,Котя (Kotya),Хулиган,"Банановый ананас, сладкий тропический микс",#FFE082,FALSE
1,Original,Kraken,"Оригинальный вкус бленда сигарного листа Seco с нотками орехов, сухофруктов и мёда, без дополнительной ароматизации",#6B4F2A,FALSE
1,Cheddar Cheese,Kraken,"Гастрономический сливочно-солёный сыр чеддер, плотный и многогранный",#6A1B9A,FALSE
1,Raspberry,Kraken,"Яркая сладко-кислая малина, ближе к малиновому варенью",#E53935,FALSE
1,Creamy Waffles,Kraken,Сладкие сливочные вафли с мягким кремовым послевкусием,#6A1B9A,FALSE
1,Passion Fruit,Kraken,"Кисло-сладкая сочная маракуйя, очень яркий тропический вкус",#FF9800,FALSE
1,Peanut,Kraken,Жареный арахис / арахисовая паста: маслянистый плотный орех,#8BC34A,FALSE
1,Mexican Lime,Kraken,"Насыщенный кислый мексиканский лайм, натуральный цитрус",#C7F000,FALSE
1,Lychee Strawberry,Kraken,Классический микс сладкого тропического личи и сочной клубники,#F8BBD0,FALSE
1,Gooseberry,Kraken,Кисло-вяжущий вкус спелого крыжовника,#8BC34A,FALSE
1,Strawberry,Kraken,Сочная сладкая клубника с лёгкой кислинкой,#FF4F79,FALSE
1,Wild Strawberry,Kraken,Дикая лесная земляника: насыщенная сладость с лёгкой кислинкой,#8BC34A,FALSE
1,Cookie,Kraken,"Сладкое песочное печенье, маслянистая выпечка",#D7B899,FALSE
1,Black Currant,Kraken,Спелая чёрная смородина с балансом сладости и кислинки,#2E1A47,FALSE
1,Black Corn,Kraken,"Вкус варёной сливочной кукурузы, мягкий зерновой профиль",#6A1B9A,FALSE
1,Pomegranate,Kraken,Кисло-сладкий вкус зёрен спелого граната,#C62828,FALSE
1,Lemon Cake,Kraken,Сливочный лимонный кекс с нотами цедры и ванили,#6A1B9A,FALSE
1,Hazelnut,Kraken,"Жареный фундук / ореховая паста, насыщенный ореховый вкус",#8BC34A,FALSE
1,Moroccan Mint,Kraken,Натуральная марокканская мята / мятный чай,#4DD0E1,FALSE
1,Rum Cake,Kraken,Сладкий ромовый кекс с алкогольной нотой,#8BC34A,FALSE
1,Porto Ruby,Kraken,Красный портвейн Ruby: виноградный вкус с нотами сухофруктов,#7E57C2,FALSE
1,Old Bourbon,Kraken,"Выдержанный бурбон: древесные ноты, ваниль и карамель",#F5E6CC,FALSE
1,Earl Grey Tea,Kraken,Чай Earl Grey: чёрный чай с нотой бергамота,#8D6E63,FALSE
1,Fig Peach,Kraken,Инжирный персик: сладкий персик с джемовыми оттенками,#FFCC80,FALSE
1,Yubari Melon,Kraken,Дыня Юбари: очень сладкая премиальная дыня,#DCE775,FALSE
1,Guava Supreme,Kraken,Спелая гуайява: плотный тропический вкус,#FFC107,FALSE
1,Cuban Blend,Kraken,"Безароматический сигарный бленд: какао, шоколад, дерево и кожа",#6B4F2A,FALSE
1,Dominican Andullo,Kraken,Доминиканский Андулло: древесно-пряный табак с минеральными нотами,#6B4F2A,FALSE
1,Habano Ecuadorian Capa,Kraken,Безароматический лист Habano из Эквадора,#8BC34A,FALSE
1,Cigar Medium,Kraken,Сигара Medium для кальяна: классический сигарный букет средней крепости,#6B4F2A,FALSE
1,Cigar Strong,Kraken,Сигара Strong для кальяна: интенсивный сигарный вкус,#6B4F2A,FALSE
1,Tropicano,Joy,Тропический микс ананаса и маракуйи с лёгким лимонным акцентом,#FFD54F,FALSE
1,Caramella,Joy,Клубника в карамели: сладкая клубника с мягким карамельным фоном,#FF4F79,FALSE
1,Pink Gin,Joy,Малиновый джин: кислая малина и сухой джин,#E53935,FALSE
1,Always Stay Pine,Joy,"Сосна, фейхоа и эвкалипт",#4CAF50,FALSE
1,Green Energy,Joy,"Энергетик, киви и лайм: бодрящий цитрусово-фруктовый профиль",#66BB6A,FALSE
1,Beach Peach,Joy,Персик и лимон: сладкий персиковый нектар с лимонной кислотой,#FFCC80,FALSE
1,Jasmino,Joy,"Зелёный чай, жасмин и дикие ягоды",#8D6E63,FALSE
1,Kiwichanga,Joy,Киви и фейхоа: сладкое фейхоа с лёгкой кислинкой киви,#66BB6A,FALSE
1,Dr. Grape,Joy,"Виноградная газировка, сладкая и пузырьковая",#7E57C2,FALSE
1,Meloman,Joy,Дыня и папайя: мягкая сладкая тропическая пара,#DCE775,FALSE
1,Orangelato,Joy,"Апельсиновое мороженое, цитрусовый пломбир",#FFA500,FALSE
1,Chudo Peach,Joy,"Персиковый йогурт, нежный и сливочный",#FFCC80,FALSE
1,Red Hot Chili Citrus,Joy,Цитрус и перец чили: лимонно-апельсиновый микс с жгучей нотой,#FFE066,FALSE
1,Joyberry,Joy,"Малина, клубника и чёрная смородина",#E53935,FALSE
1,Marmeladno,Joy,"Мармелад, киви и дикие ягоды",#66BB6A,FALSE
1,Black on Black,Joy,Кола и кофе: газировка с кофейной горчинкой,#3E2723,FALSE
1,Lemon Brothers,Joy,"Лимон, лайм и ревень",#FFE066,FALSE
1,Tokyo Dream,Joy,"Клубника, малина, грейпфрут и сакура",#FF4F79,FALSE
1,Pears of Joy,Joy,"Груша, мускус и ваниль",#C9E265,FALSE
1,Yume Tea,Joy,"Персик, молочный улун и мёд",#FFCC80,FALSE
1,Jungle Juice,Joy,"Маракуйя, папайя и морковь",#FF9800,FALSE
1,Abricot,Trofimoff,Сладкий спелый абрикос с лёгкой кислинкой,#FFB300,FALSE
1,Base,Trofimoff,Чистый ферментированный бурли без ароматизаторов,#8BC34A,FALSE
1,Baileys,Trofimoff,Сливочный кофейно-ванильный ликёр,#6A1B9A,FALSE
1,Cashmere Guava,Trofimoff,Гуава с пряными кашмирскими специями,#43A047,FALSE
1,Cashmere Nectarine,Trofimoff,Нектарин с кашмирными пряностями,#8BC34A,FALSE
1,Cocos,Trofimoff,Нежная кокосовая стружка и кокосовое молоко,#8BC34A,FALSE
1,Cookies,Trofimoff,Песочное печенье с ванилью и сливочным маслом,#D7B899,FALSE
1,Crespino,Trofimoff,Барбарис: яркая кислота и карамельная сладость,#C62828,FALSE
1,Dark Plum,Trofimoff,"Тёмный чернослив, плотный и чуть дымный",#8BC34A,FALSE
1,Double Apple,Trofimoff,Классический микс красного и зелёного яблока с анисовой нотой,#8BC34A,FALSE
1,Elder Flowers,Trofimoff,"Цветы бузины, мягкий цветочно-сладкий вкус",#8BC34A,FALSE
1,Grapefruit,Trofimoff,Сочный грейпфрут с балансом сладости и кислоты,#FF6F61,FALSE
1,Green Apple,Trofimoff,Хрустящее зелёное яблоко с выраженной кислинкой,#8BC34A,FALSE
1,Green Tea,Trofimoff,Мягкий травянисто-зелёный чай,#8D6E63,FALSE
1,Jasminium,Trofimoff,"Жасминовый чай, тонкий цветочный профиль",#8D6E63,FALSE
1,Hurtleberry,Trofimoff,Тёмная лесная ягода / чёрная смородина,#C2185B,FALSE
1,Kiwi,Trofimoff,Зелёное киви с мягкой тропической кислинкой,#66BB6A,FALSE
1,Kriek,Trofimoff,Вишнёвое пиво с лёгкой солодовой нотой,#8B1E3F,FALSE
1,Lavander,Trofimoff,"Цветки лаванды, сладко-цветочный профиль",#9575CD,FALSE
1,Limonata,Trofimoff,"Лимонадный лимон, яркий цитрус",#FFE066,FALSE
1,Mangifera,Trofimoff,Сливочный манго с мягкой сладостью,#6A1B9A,FALSE
1,Mint,Trofimoff,Сладкая мята без сильного ментола,#4DD0E1,FALSE
1,Nurr,Trofimoff,"Гранат, кисло-сладкие зёрна",#C62828,FALSE
1,Old School Orange,Trofimoff,Классический апельсин с лёгкой горчинкой корки,#FFA500,FALSE
1,Opuntia Pear,Trofimoff,Груша опунции / кактусовая груша,#C9E265,FALSE
1,Pan Banan,Trofimoff,"Спелый банан, кремовый и сладкий",#FFE082,FALSE
1,Peach,Trofimoff,Сочный персик с бархатной мякотью,#FFCC80,FALSE
1,Pineapple,Trofimoff,"Сочный ананас, сладко-кислый тропик",#FFD54F,FALSE
1,Popcorn,Trofimoff,Карамельный попкорн,#C68E17,FALSE
1,Red Currant,Trofimoff,Красная смородина с яркой кислотой,#2E1A47,FALSE
1,Regan,Trofimoff,"Красный базилик, пряно-травяной",#2E7D32,FALSE
1,Ruby Grapes,Trofimoff,"Красный виноград, сладкий с винной нотой",#7E57C2,FALSE
1,Tangerine,Trofimoff,Марокканский мандарин,#FFA726,FALSE
1,Watermelon,Trofimoff,Арбузная мякоть с травянистой корочкой,#66BB6A,FALSE
1,Wild Strawberry,Trofimoff,"Дикая земляника, сладко-ягодный профиль",#C2185B,FALSE
1,Wintergreen,Trofimoff,Мятная приправа с охлаждением,#4DD0E1,FALSE
1,Yellow Lemon,Trofimoff,"Жёлтый лимон, яркая кислота",#FFE066,FALSE
1,Sri Lanka,Trofimoff,Крепкий чёрный чай цейлон,#8D6E63,FALSE
1,Gingerbread,Trofimoff,Имбирный пряник со специями,#FF7043,FALSE
1,Ginger Ale,Trofimoff,Имбирный эль,#FF7043,FALSE
1,Sujuk,Trofimoff,Суджук / сырокопчёная колбаса,#8BC34A,FALSE
1,Nobilis,Trofimoff,"Сосна, смолистые хвойные ноты",#8BC34A,FALSE
1,Rhubarb,Trofimoff,"Ревень, освежающая кислинка",#8BC34A,FALSE
1,Coke,Trofimoff,"Кола, сладкий газированный напиток",#3E2723,FALSE
1,Verry Berry (HCS 2024),Trofimoff,Лимитированный ягодный микс с густой сладостью,#C2185B,FALSE
1,Salvia (HCS 2024),Trofimoff,Лимитированная безаромка с травянистым профилем,#8BC34A,FALSE
1,Crud (HCS 2024),Trofimoff,Лимитированная десертно-табачная безаромка,#8BC34A,FALSE
1,Pear Date (JCF),Trofimoff,"Инжир и груша, плотный сухофруктовый профиль",#C9E265,FALSE
1,Calvados (JCF),Trofimoff,Бочковой яблочный кальвадос,#8BC34A,FALSE
1,Finlandia Vanila (Terror),Trofimoff,Ванильная водка,#F5E6CC,FALSE
1,Like-Zaghoul (No aroma),Trofimoff,Безаромка в стиле загул,#8BC34A,FALSE
1,Italia (No aroma),Trofimoff,Итальянский бурли,#8BC34A,FALSE
1,Shurale (No aroma),Trofimoff,Бальзамная безаромка,#8BC34A,FALSE
1,Jenever (No aroma),Trofimoff,Настой на джиноподобном напитке,#8BC34A,FALSE
1,Spirit (No aroma),Trofimoff,Алкогольно-табачная безаромка,#8BC34A,FALSE
1,Anejo (No aroma),Trofimoff,Выдержанный ром,#8BC34A,FALSE
1,Cognac (No aroma),Trofimoff,Коньячный настой,#8BC34A,FALSE
1,Limoncello (No aroma),Trofimoff,Ликёр лимончелло,#FFE066,FALSE
1,Virgin (No aroma),Trofimoff,«Верджин» безаромка,#8BC34A,FALSE
1,Ortica (No aroma),Trofimoff,"Ортика, травянистый профиль",#8BC34A,FALSE
1,Amarena Cherry (Black),Sebero,Итальянская вишня Амарена,#8B1E3F,FALSE
1,Apple Juice (Black),Sebero,"Яблочный сок, свежевыжатый",#8BC34A,FALSE
1,Bubble Gum (Black),Sebero,Ностальгическая фруктовая жвачка из 00-х,#8BC34A,FALSE
1,Cactus (Black),Sebero,Сочная мякоть кактуса с тропическими оттенками,#8BC34A,FALSE
1,Cookie Monster (Black),Sebero,Сливочное печенье с кокосовой стружкой,#6A1B9A,FALSE
1,Garnet (Black),Sebero,"Гранатовый сок, густой и насыщенный",#C62828,FALSE
1,Grape (Black),Sebero,"Тёмный виноград, между газировкой и конфетой",#7E57C2,FALSE
1,Grapefruit (Black),Sebero,Грейпфрутовый фреш,#FF6F61,FALSE
1,Herbal Currant (Black),Sebero,Чёрная смородина и ревень,#2E1A47,FALSE
1,Lemon Candy (Black),Sebero,Лимонные леденцы,#FFE066,FALSE
1,Limoncello (Black),Sebero,Сочный лимонный ликёр без алкоголя,#FFE066,FALSE
1,Mellow Mango (Black),Sebero,Мягкий спелый манго,#FFC107,FALSE
1,Mango Yogurt (Black),Sebero,Манго-йогурт,#FFC107,FALSE
1,Mint (Black),Sebero,Чистая мята с выраженным холодком,#4DD0E1,FALSE
1,Dyusha (Black),Sebero,Классический лимонад «Дюшес»,#FFE066,FALSE
1,Prunes (Black),Sebero,"Чернослив, густой сухофруктовый вкус",#8BC34A,FALSE
1,Red Skittles (Black),Sebero,Красные,#8BC34A,FALSE
1,Root Beer (Black),Sebero,"Root beer, пряный сливочный напиток",#6A1B9A,FALSE
1,Strawberry (Black),Sebero,"Садовая клубника, плотное варенье",#FF4F79,FALSE
1,Strawberry-Banana (Black),Sebero,Садовая клубника и спелый банан,#FF4F79,FALSE
1,Top (Black),Sebero,Клубника и варёная кукуруза,#FF4F79,FALSE
1,Watermelon (Black),Sebero,"Арбуз-дыня, летний микс",#66BB6A,FALSE
1,Wild Berries (Black),Sebero,"Дикие ягоды, кисло-сладкий компот",#C2185B,FALSE
1,Lemon Fizz (Black),Sebero,Лимонная шипучка,#FFE066,FALSE
1,Color of India (Black),Sebero,"Карри, тёплый гастрономический профиль",#8BC34A,FALSE
1,Vanilla (Black),Sebero,Сладкая ваниль для тёмной базы,#F5E6CC,FALSE
1,Adrenalin,Sebero,"Лимон, фейхоа, энергетик и холодок",#FFE066,FALSE
1,Banana Donut,Sebero,Банановый пончик с корицей,#FFE082,FALSE
1,Bubble Fruit,Sebero,"Баблгам, виноград, голубика, манго и лёд",#7E57C2,FALSE
1,Cactus Pear,Sebero,"Кактус, лимончелло, груша, мята и лёд",#8BC34A,FALSE
1,Caramel Glass,Sebero,"Карамель, вафли, ваниль и лёд",#C68E17,FALSE
1,Cream Berry,Sebero,"Взбитые сливки, черника, вишня и гранат с чаем и льдом",#6A1B9A,FALSE
1,Cucumber Sprite,Sebero,"Спрайт, огурец, лайм и сильный холодок",#C7F000,FALSE
1,Fruit Tea,Sebero,Фруктовый чай с холодком,#8D6E63,FALSE
1,Fruit Yogurt,Sebero,"Манго, малина, сливки и лёд",#FFC107,FALSE
1,Fresh Time,Sebero,"Чабрец, вишня, манго, лимон и лёд",#8B1E3F,FALSE
1,Jelly Fruit,Sebero,Желейные фрукты с прохладой,#8BC34A,FALSE
1,Juicy Shake,Sebero,"Виноград, мята, арбуз, малина, базилик, лимон, лайм и лёд",#7E57C2,FALSE
1,Lychee Juice,Sebero,"Личи, груша, лимонад, персик и лёд",#F8BBD0,FALSE
1,Melon Ron Do,Sebero,"Дыня, арбуз и холодок",#DCE775,FALSE
1,Morozhenka,Sebero,Фруктовое мороженое,#FFF8E1,FALSE
1,Okroshka Time,Sebero,Огуречно-травяной лимонад с холодком,#FFE066,FALSE
1,Pop Star,Sebero,"Арбуз, дыня, лайм, мята и лёд",#66BB6A,FALSE
1,Spice Fruit,Sebero,"Пряный чай, гуава, клубника, ревень, чёрная смородина и лёд",#8D6E63,FALSE
1,Summer Vibe,Sebero,"Малина, ревень, табачная нота и лёд",#E53935,FALSE
1,Tropic Berry,Sebero,Тропические фрукты и ягоды с холодком,#C2185B,FALSE
1,Vanilla Fruit,Sebero,Сливочная ваниль и фруктовый микс с холодком,#6A1B9A,FALSE
1,Tarragon,Sebero,"Базилик, огурец, кола, абрикос, клубника, банан и лёд",#2E7D32,FALSE
1,Arctic,Sebero,Чистый холодок,#8BC34A,FALSE
1,Apricot,Sebero,"Сладкий спелый абрикос, мягкий и сочный",#FFB300,FALSE
1,Banana,Sebero,Классический спелый банан,#FFE082,FALSE
1,Banana Cream,Sebero,Банановый крем-десерт,#FFE082,FALSE
1,Barberry,Sebero,Барбарисовая конфета,#C62828,FALSE
1,Berry Sorbet,Sebero,Ягодный сорбет,#C2185B,FALSE
1,Black & White,Sebero,Мороженое с шоколадной крошкой,#FFF8E1,FALSE
1,Blueberry,Sebero,Черничный йогурт / джем,#FFF3E0,FALSE
1,Corn,Sebero,Варёная сладкая кукуруза,#8BC34A,FALSE
1,Energetic,Sebero,Кисло-сладкий энергетик,#8BC34A,FALSE
1,Feijoa,Sebero,Яркое фейхоа,#4CAF50,FALSE
1,Gentle Berry,Sebero,Нежный ягодный микс,#C2185B,FALSE
1,Halloween,Sebero,Тыквенный десерт,#8BC34A,FALSE
1,Herbal Currant (Classic),Sebero,Ревень и чёрная смородина,#2E1A47,FALSE
1,Ho Ho Ho,Sebero,Чистый мягкий холодок,#8BC34A,FALSE
1,Honey Melon,Sebero,Медовая дыня,#DCE775,FALSE
1,Juicy Peach,Sebero,Сочный спелый персик,#FFCC80,FALSE
1,Kiwi Fresh,Sebero,Зелёное киви,#66BB6A,FALSE
1,Limoncello (Classic),Sebero,Лимончелло без алкоголя,#FFE066,FALSE
1,Mango,Sebero,Сладкий спелый манго,#FFC107,FALSE
1,Moloko (Sweet Milk),Sebero,Сладкое молочко,#8BC34A,FALSE
1,Orange,Sebero,Сочный апельсиновый фреш,#FFA500,FALSE
1,Papaya,Sebero,Плотная папайя,#FFB74D,FALSE
1,Passion Fruit,Sebero,Классическая маракуйя,#FF9800,FALSE
1,Pine Nut,Sebero,Кедровый орех,#8BC34A,FALSE
1,Pineapple,Sebero,Ананасовый сок,#FFD54F,FALSE
1,Red Flag,Sebero,Кизиловая конфета,#8BC34A,FALSE
1,Raspberries,Sebero,Спелая малина,#E53935,FALSE
1,RRB,Sebero,"Малина, красная смородина и черника",#E53935,FALSE
1,Stopka,Sebero,"Водка, чистый алкогольный вкус",#8BC34A,FALSE
1,Strawberry,Sebero,Садовая клубника,#FF4F79,FALSE
1,Strawberry Gum,Sebero,Клубничная жвачка с мятой,#4DD0E1,FALSE
1,Tiramisu,Sebero,Сливочный десерт тирамису,#6A1B9A,FALSE
1,Tropic Bloom,Sebero,Роза и тропические фрукты,#FFC107,FALSE
1,Vanilla (Classic),Sebero,Тёплая ваниль,#F5E6CC,FALSE
1,Very Sour,Sebero,Цитрусовый шок,#FFD166,FALSE
1,Waffle,Sebero,Сливочные бельгийские вафли,#6A1B9A,FALSE
1,Wonder Melon,Sebero,Арбуз и дыня,#66BB6A,FALSE
1,Guava Strawberry,Sebero,Гуава и клубника,#43A047,FALSE
1,Banana Strawberry,Sebero,Банан и клубника,#FFE082,FALSE
1,Painflower,Sebero,Пассифлора,#8BC34A,FALSE
1,Blue Forest / Blueberry (Classic),Sebero,Черника в сливочном десерте,#3F51B5,FALSE
1,Ара халва,Северный,Сладкая арахисовая халва,#8BC34A,FALSE
1,Арабский фрукт,Северный,Микс южных фруктов,#8BC34A,FALSE
1,Алтайский сбор,Северный,Травяной чай с мёдом и ягодами,#8D6E63,FALSE
1,Арбузный Sorbet,Северный,Холодный арбузный сорбет,#66BB6A,FALSE
1,Блатной грейпфрут,Северный,Яркий розовый грейпфрут,#FF6F61,FALSE
1,Блэк Джекфрут,Северный,Сладкий тропический джекфрут,#FFC107,FALSE
1,Босяцкое яблоко,Северный,Печёное зелёное яблоко,#8BC34A,FALSE
1,Борзый эвкалипт,Северный,Жёсткий эвкалиптовый холодок,#26A69A,FALSE
1,Вальтовый какао,Северный,Плотный какао,#5D4037,FALSE
1,Восточные пряности,Северный,Тёплый микс восточных специй,#8BC34A,FALSE
1,Взлётный лайм,Северный,Очень яркий кислый лайм,#C7F000,FALSE
1,Виноградный Sorbet,Северный,Холодный десерт из сладкого винограда,#7E57C2,FALSE
1,Волчья ягода,Северный,Лесные ягоды с хвойным фоном,#C2185B,FALSE
1,Вольный абрикос,Северный,Спелый сладкий абрикос,#FFB300,FALSE
1,Воровская облепиха,Северный,Яркая кисло-сладкая облепиха,#8BC34A,FALSE
1,Выпьем за морковь,Северный,Морковный фреш с цитрусом,#FFD166,FALSE
1,Геройский виноград,Северный,Чёрный виноград (изабелла),#7E57C2,FALSE
1,Грешный… (Грушевый сидр),Северный,Сладкий грушевый сидр,#C9E265,FALSE
1,Грейпфрут Тоник,Северный,Грейпфрут с горчинкой тоника,#FF6F61,FALSE
1,Дерзкий абсент,Северный,Анисовый ликёр с холодком,#8BC34A,FALSE
1,Душевный ром,Северный,Тёмный ром с ванилью и дубом,#F5E6CC,FALSE
1,Заводной апельсин,Северный,Сочный апельсин с корицей,#FFA500,FALSE
1,Завтрак Джуманджи,Северный,Тропический фруктовый смузи,#FFC107,FALSE
1,Звездный кактус,Северный,Сладкий кактус с охлаждением,#8BC34A,FALSE
1,Зеленая Миля,Северный,Свежий цитрусово-ягодный микс,#C2185B,FALSE
1,Зеленый чай,Северный,Мягкий зелёный чай,#8D6E63,FALSE
1,Зимние забавы,Северный,Зимний горячий напиток,#8BC34A,FALSE
1,Кайпиринья,Северный,Лаймовый коктейль с сахаром и ромовой нотой,#C7F000,FALSE
1,Киви от Гиви,Северный,Сладкое спелое киви,#66BB6A,FALSE
1,Клубничная феерия,Северный,Спелая клубника с личи,#FF4F79,FALSE
1,Корица по жизни,Северный,Насыщенная корица,#8D6E63,FALSE
1,Крепкий орешек,Северный,Жареный орех с карамелью,#C68E17,FALSE
1,Крошка Айва,Северный,Ароматная айва,#8BC34A,FALSE
1,Кровавая Мэри,Северный,Томатный коктейль со специями,#8BC34A,FALSE
1,Леди Грей,Северный,Чёрный чай Эрл Грей с бергамотом и грейпфрутом,#8D6E63,FALSE
1,Лесная фантазия,Северный,Микс лесных ягод с хвойной свежестью,#C2185B,FALSE
1,Лимон Лайм,Северный,Кислый микс лимона и лайма,#FFE066,FALSE
1,Личи в ажуре,Северный,Сладкий личи с цветочными нотами,#F8BBD0,FALSE
1,Малиновый руби,Северный,Яркая сладкая малина,#E53935,FALSE
1,Малиновый Sorbet,Северный,Нежный холодный малиновый сорбет,#E53935,FALSE
1,Малина в законе,Северный,Плотная садовая малина,#E53935,FALSE
